{
  "vct": "eu.we-build:esgcertificate:1",
  "iss": "did:example:accredited-cert-issuer-123",
  "iat": 1724284800,
  "exp": 1882051200,
  "attestation_legal_category": "QEAA",
  "type": "ISO9001",
  "version": "2015",
  "registration_number": "DE015008",
  "registration_initial_date": "2024-08-22",
  "registration_expiration_date": "2027-08-22",
  "legal_entity": {
    "legal_person": {
      "legal_person_name": "Robert Bosch GmbH",
      "legal_form_type": "GmbH"
    },
    "identifier": {
      "euid": "DE.HRB.12345",
      "lei": "529900T8BM49AURSDO55",
      "tax": "DE811001001"
    },
    "address": {
      "street": "Robert-Bosch-Platz",
      "house_number": "1",
      "locality": "Gerlingen-Schillerhöhe",
      "region": "Baden-Württemberg",
      "postal_code": "70839",
      "country": "DE"
    }
  },
  "scope": [
    {
      "legal_entity_name": "Robert Bosch GmbH",
      "legal_entity_identifier": {
        "bpnl": "BPNL00000003CML1"
      },
      "site_identifier": "urn:uuid:f81d4fae-7dec-11d0-a765-00a0c91e6bf6",
      "site_address": {
        "street": "Auf der Breit",
        "house_number": "4",
        "locality": "Karlsruhe",
        "region": "Baden-Württemberg",
        "postal_code": "76227",
        "country": "DE"
      },
      "scope_description": "Development, production and distribution of products and services for the automotive aftermarket.",
      "certified_site": true
    }
  ],
  "evidence": {
    "id": "urn:uuid:6e8bc430-9c3a-11d9-9669-0800200c9a66",
    "type": "OriginalCertificate",
    "url": "https://certificates.issuer.com/DE015008.pdf"
  },
  "status": {
    "type": "status-list",
    "status_list_credential": "https://issuer.example.com/status/esg/2024",
    "status_list_index": 101,
    "status_purpose": "revocation"
  },
  "cnf": {
    "jwk": {
      "kty": "EC",
      "crv": "P-256",
      "x": "TCAER19Zvu3OHF4j4W4vfSVoHIP1ILilDls7vCeGemc",
      "y": "ZxjiWWbZMQGHVWKVQ4hbSIirsVfuecCE6t4jT9F2HZQ"
    }
  }
}